{"id":"deb-fischer","name":"Deb Fischer","title":"Senator","state":"Nebraska","party":"Republican","chamber":"Senate","seniority":"Senior","term_start":"2025-01-03","term_end":"2031-01-03","biography":{"summary":"Deb Fischer is a United States Senator from Nebraska who has served since January 3, 2013. A Republican, she has focused on issues including agricultural policy, national security, and fiscal responsibility, representing Nebraska in the Senate."},"photo":{"profile":"https://unitedstates.github.io/images/congress/225x275/F000463.jpg","header":"https://unitedstates.github.io/images/congress/450x550/F000463.jpg"},"contact":{"website":"https://www.fischer.senate.gov","office_address":"448 Russell Senate Office Building Washington DC 20510","phone":"202-224-6551","fax":"202-228-1325","email_form":"https://www.fischer.senate.gov/public/index.cfm/contact"}}