{"id":"mike-lee","name":"Mike Lee","title":"Senator","state":"Utah","party":"Republican","chamber":"Senate","seniority":"Senior","term_start":"2023-01-03","term_end":"2029-01-03","biography":{"summary":"Mike Lee is an American attorney and politician serving as the senior United States Senator from Utah since 2011. A member of the Republican Party, he is known for conservative constitutionalist positions.","early_life":"Born June 4, 1971; raised in Utah; earned a law degree from Brigham Young University.","education":"Brigham Young University (B.A.), Brigham Young University J. Reuben Clark Law School (J.D.).","career":"Attorney and former Utah state politician; has served as a U.S. Senator since 2011."},"photo":{"profile":"https://unitedstates.github.io/images/congress/450x550/L000577.jpg","header":"https://unitedstates.github.io/images/congress/original/L000577.jpg"},"contact":{"website":"https://www.lee.senate.gov","office_address":"363 Russell Senate Office Building, Washington DC 20510","phone":"202-224-5444","email_form":"https://www.lee.senate.gov/public/index.cfm/contact","social":{}},"committees":[{"name":"Committee on Appropriations","position":"Member"},{"name":"Committee on the Judiciary","position":"Member"},{"name":"Committee on Energy and Natural Resources","position":"Member"},{"name":"Committee on the Budget","position":"Member"}],"policy_positions":[{"topic":"Constitutional interpretation","stance":"Conservative"},{"topic":"Taxes and Economic policy","stance":"Supports lower taxes and limited government"}],"legislation":{"bills_sponsored":[],"recent_votes":[]},"timeline":[{"year":"2011","event":"Elected to the U.S. Senate from Utah (Class 3)"},{"year":"2017","event":"Re-elected to the U.S. Senate"},{"year":"2023","event":"Started current term as U.S. Senator from Utah"}],"media":{"photos":["https://unitedstates.github.io/images/congress/450x550/L000577.jpg","https://unitedstates.github.io/images/congress/225x275/L000577.jpg"],"videos":[]}}