{"id":"mark-kelly","name":"Mark Kelly","title":"Senator","state":"Arizona","party":"Democratic","chamber":"Senate","seniority":"Senior","term_start":"2023-01-03","term_end":"2029-01-03","biography":{"summary":"Mark Kelly is a Democratic U.S. Senator from Arizona who has served since January 3, 2023, and previously served as a NASA astronaut and Navy pilot.","early_life":"Born February 21, 1964. Raised in the United States, with a career in the military and aerospace.","education":"B.S. in electrical engineering from the U.S. Naval Academy; M.S. in Space Systems Operations from the Naval Postgraduate School.","career":"Former U.S. Navy pilot and NASA astronaut, later elected to the U.S. Senate."},"photo":{"profile":"https://unitedstates.github.io/images/congress/225x275/K000377.jpg","header":"https://unitedstates.github.io/images/congress/450x550/K000377.jpg"},"contact":{"website":"https://www.kelly.senate.gov","office_address":"516 Hart Senate Office Building Washington DC 20510","phone":"202-224-2235","email_form":"https://www.kelly.senate.gov/contact/contact-form/"},"committees":[],"policy_positions":[],"legislation":{"bills_sponsored":[],"recent_votes":[]},"timeline":[],"media":{"photos":["https://unitedstates.github.io/images/congress/225x275/K000377.jpg","https://unitedstates.github.io/images/congress/450x550/K000377.jpg","https://unitedstates.github.io/images/congress/original/K000377.jpg"],"videos":[]}}