{"id":"gary-peters","name":"Gary C. Peters","title":"Senator","state":"Michigan","party":"Democratic","chamber":"Senate","seniority":"Senior","term_start":"2021-01-03","term_end":"2027-01-03","biography":{"summary":"Gary C. Peters is a Democratic U.S. Senator from Michigan who took office in 2021. He previously served in the U.S. House of Representatives from 2009 to 2015, representing Michigan's 9th and 14th districts."},"photo":{"profile":"https://unitedstates.github.io/images/congress/450x550/P000595.jpg","header":"https://unitedstates.github.io/images/congress/original/P000595.jpg"},"contact":{"website":"https://www.peters.senate.gov","office_address":"724 Hart Senate Office Building Washington DC 20510","phone":"202-224-6221","fax":"202-226-2356","email_form":"https://www.peters.senate.gov/contact/email-gary","social":{}}}