{"id":"mark-warner","name":"Mark R. Warner","title":"Senator","state":"Virginia","party":"Democratic","chamber":"Senate","seniority":"Senior","term_start":"2021-01-03","term_end":"2027-01-03","biography":{"summary":"Mark R. Warner is the senior United States Senator from Virginia, serving since 2009. A Democrat, he previously served as Governor of Virginia (2002-2006) and as a technology entrepreneur.","early_life":"Not listed in the provided data.","education":"Not listed in the provided data.","career":"Not listed in the provided data."},"photo":{"profile":"https://unitedstates.github.io/images/congress/450x550/W000805.jpg","header":"https://unitedstates.github.io/images/congress/original/W000805.jpg"},"contact":{"office_address":"703 Hart Senate Office Building, Washington DC 20510","phone":"202-224-2023","fax":"202-224-6295","email_form":"https://www.warner.senate.gov/public/index.cfm?p=Contact","website":"https://www.warner.senate.gov","social":{"twitter":"https://twitter.com/SenMarkWarner"}},"committees":[{"name":"Appropriations Committee","position":"Member"},{"name":"Select Committee on Intelligence","position":"Member"},{"name":"Banking, Housing, and Urban Affairs","position":"Member"}],"policy_positions":[{"topic":"Economic policy","stance":"Support"},{"topic":"Health care","stance":"Support"},{"topic":"Campaign finance reform","stance":"Support"},{"topic":"Technology and innovation","stance":"Support"}],"timeline":[{"year":"2009","event":"Elected U.S. Senator from Virginia (Democratic)"},{"year":"2014","event":"Re-elected to the U.S. Senate"},{"year":"2021","event":"Assumed current Senate term (2021-2027)"},{"year":"2023","event":"Appointed Senate Democratic Conference Vice Chair"}],"media":{"photos":["https://unitedstates.github.io/images/congress/450x550/W000805.jpg","https://unitedstates.github.io/images/congress/original/W000805.jpg"],"videos":[]}}