{"id":"chris-van-hollen","name":"Chris Van Hollen","title":"Senator","state":"Maryland","party":"Democratic","chamber":"Senate","seniority":"Senior","term_start":"2023-01-03","term_end":"2029-01-03","biography":{"summary":"Chris Van Hollen is a Democratic U.S. Senator from Maryland, serving in the Senate since January 3, 2017. He previously represented Maryland's 8th congressional district in the U.S. House from 2003 to 2017, focusing on fiscal policy, national security, and education."},"photo":{"profile":"https://unitedstates.github.io/images/congress/225x275/V000128.jpg","header":"https://unitedstates.github.io/images/congress/450x550/V000128.jpg"},"contact":{"website":"https://www.vanhollen.senate.gov","office_address":"730 Hart Senate Office Building Washington DC 20510","phone":"202-224-4654","fax":"202-225-0375","email_form":"https://www.vanhollen.senate.gov/contact/email","social":{}}}