{"id":"ted-budd","name":"Ted Budd","title":"Senator","state":"North Carolina","party":"Republican","chamber":"Senate","seniority":"Junior","term_start":"2023-01-03","term_end":"2029-01-03","biography":{"summary":"Ted Budd is the junior United States Senator from North Carolina, serving since January 3, 2023. He previously represented North Carolina's 13th congressional district in the U.S. House of Representatives from 2017 to 2023."},"photo":{"profile":"https://unitedstates.github.io/images/congress/225x275/B001305.jpg","header":"https://unitedstates.github.io/images/congress/450x550/B001305.jpg"},"contact":{"website":"https://www.budd.senate.gov","office_address":"354 Russell Senate Office Building Washington DC 20510","phone":"202-224-3154"},"committees":[],"policy_positions":[],"legislation":{},"timeline":[],"media":{"photos":[],"videos":[]}}