{"id":"roger-marshall","name":"Roger Marshall","title":"Senator","state":"Kansas","party":"Republican","chamber":"Senate","seniority":"Junior","term_start":"2021-01-03","term_end":"2027-01-03","biography":{"summary":"Roger Marshall is a physician and politician serving as the U.S. Senator from Kansas since 2021. Before joining the Senate, he was a physician-obstetrician-gynecologist and represented Kansas's 1st congressional district as a U.S. Representative from 2017 to 2021.","early_life":"Born August 9, 1960, in the United States.","education":"Medical degree (MD) with specialization in obstetrics and gynecology; credentials include medical training and residency in obstetrics/gynecology.","career":"Physician and obstetrician-gynecologist; member of the U.S. House of Representatives (2017-2021); elected to the U.S. Senate in 2020, took office in 2021."},"photo":{"profile":"https://unitedstates.github.io/images/congress/450x550/M001198.jpg","header":"https://unitedstates.github.io/images/congress/450x550/M001198.jpg"},"contact":{"website":"https://www.marshall.senate.gov","office_address":"479 Russell Senate Office Building, Washington, DC 20510","phone":"202-224-4774","email_form":"https://www.marshall.senate.gov/contact/"},"committees":[{"name":"Health, Education, Labor, and Pensions","position":"Member"}],"policy_positions":[{"topic":"Healthcare","stance":"Supports market-based solutions and reform focused on reducing costs and increasing healthcare choice."}],"legislation":{"bills_sponsored":[],"recent_votes":[]},"timeline":[{"year":"2017","event":"Elected to U.S. House of Representatives for Kansas's 1st district."},{"year":"2021","event":"Became U.S. Senator from Kansas."}],"media":{"photos":["https://unitedstates.github.io/images/congress/450x550/M001198.jpg"],"videos":[]}}