{"id":"raphael-warnock","name":"Raphael G. Warnock","title":"Senator","state":"Georgia","party":"Democratic","chamber":"Senate","seniority":"Junior","term_start":"2023-01-03","term_end":"2029-01-03","biography":{"summary":"Raphael G. Warnock is an American pastor and politician serving as the junior United States Senator from Georgia since 2021. He was first elected in a January 2021 special election and was reelected to a full term beginning in 2023.","early_life":"Born July 23, 1969, in Savannah, Georgia.","education":"Attended Morehouse College (BA) and earned a Master of Divinity from Union Theological Seminary.","career":"Prior to his Senate career, Warnock was the senior pastor of Ebenezer Baptist Church in Atlanta and a prominent community advocate."},"photo":{"profile":"https://unitedstates.github.io/images/congress/225x275/W000790.jpg","header":"https://unitedstates.github.io/images/congress/450x550/W000790.jpg"},"contact":{"office_address":"717 Hart Senate Office Building, Washington DC 20510","phone":"202-224-3643","fax":"202-228-0724","email_form":"https://www.warnock.senate.gov/contact/","website":"https://www.warnock.senate.gov"},"committees":[],"policy_positions":[],"legislation":{"bills_sponsored":[],"recent_votes":[]},"timeline":[],"media":{"photos":["https://unitedstates.github.io/images/congress/225x275/W000790.jpg","https://unitedstates.github.io/images/congress/450x550/W000790.jpg"],"videos":[]}}