{"id":"ben-ray-lujan","name":"Ben Ray Luján","title":"Senator","state":"New Mexico","party":"Democratic","chamber":"Senate","seniority":"Junior","term_start":"2021-01-03","term_end":"2027-01-03","biography":{"summary":"Ben Ray Luján is the junior United States Senator from New Mexico, serving since 2021. A Democrat, he previously served as U.S. Representative for New Mexico's 3rd congressional district from 2009 to 2021, including a term as Assistant Speaker (2019-2021)."},"photo":{"profile":"https://unitedstates.github.io/images/congress/450x550/L000570.jpg","header":"https://unitedstates.github.io/images/congress/900x300/L000570.jpg"},"contact":{"office_address":"498 Russell Senate Office Building, Washington, DC 20510","phone":"202-224-6621","fax":"N/A","email_form":"https://www.lujan.senate.gov/contact/","website":"https://www.lujan.senate.gov"},"committees":[{"name":"Appropriations","position":"Member"},{"name":"Armed Services","position":"Member"},{"name":"Commerce, Science, and Transportation","position":"Member"}],"policy_positions":[{"topic":"Healthcare","stance":"Supports expanding access to affordable healthcare and protections for Medicare."},{"topic":"Education","stance":"Supports federal investments in public education and student loan relief."},{"topic":"Energy and Environment","stance":"Supports clean energy initiatives and emission reduction policies."}],"legislation":{"bills_sponsored":[],"recent_votes":[]},"timeline":[{"year":"2009","event":"Elected to the U.S. House of Representatives from New Mexico's 3rd district; term began January 2009."},{"year":"2019","event":"Became Assistant Speaker of the House."},{"year":"2021","event":"Took office as United States Senator from New Mexico (Class 2)."}],"media":{"photos":["https://unitedstates.github.io/images/congress/450x550/L000570.jpg","https://unitedstates.github.io/images/congress/900x300/L000570.jpg"],"videos":[]}}