{"id":"john-barrasso","name":"John A. Barrasso","title":"Senator","state":"Wyoming","party":"Republican","chamber":"Senate","seniority":"Senior","term_start":"2025-01-03","term_end":"2031-01-03","biography":{"summary":"John A. Barrasso is an American politician serving as the United States Senator from Wyoming, first elected in 2007. A physician by training, he is a member of the Republican Party and has held leadership roles in the Senate, including Senate Republican Conference Chair since 2019 and named Senate Majority Whip in 2025.","early_life":"Born July 21, 1952.","education":"Bachelor's degree from the University of Wyoming; Doctor of Medicine from Georgetown University School of Medicine.","career":"Orthopedic surgeon and physician in Wyoming; served in the Wyoming State Senate before being elected to the U.S. Senate in 2007."},"photo":{"profile":"https://unitedstates.github.io/images/congress/450x550/B001261.jpg"},"contact":{"website":"https://www.barrasso.senate.gov","office_address":"307 Dirksen Senate Office Building, Washington, DC 20510","phone":"202-224-6441","fax":"202-224-1724","email_form":"https://www.barrasso.senate.gov/public/index.cfm/contact-form"}}