{"id":"roger-wicker","name":"Roger F. Wicker","title":"Senator","state":"Mississippi","party":"Republican","chamber":"Senate","seniority":"Senior","term_start":"2025-01-03","term_end":"2031-01-03","biography":{"summary":"Roger F. Wicker is a Republican United States Senator from Mississippi, serving in the U.S. Senate in Class 1. He previously served as a U.S. Representative for Mississippi's 1st district from 1995 to 2007. He has focused on defense, budget, and trade issues during his tenure in Congress."},"photo":{"profile":"https://unitedstates.github.io/images/congress/225x275/W000437.jpg","header":"https://unitedstates.github.io/images/congress/450x550/W000437.jpg"},"contact":{"office_address":"425 Russell Senate Office Building Washington DC 20510","phone":"202-224-6253","fax":"202-228-0378","email_form":"https://www.wicker.senate.gov/public/index.cfm/contact","website":"https://www.wicker.senate.gov"},"committees":[{"name":"Appropriations","position":"Member"},{"name":"Commerce, Science, and Transportation","position":"Member"}],"policy_positions":[],"legislation":{"bills_sponsored":[],"recent_votes":[]},"timeline":[{"year":"1995","event":"Elected to the U.S. House of Representatives for Mississippi's 1st district."},{"year":"2007","event":"Elected to the U.S. Senate from Mississippi; began Senate term."},{"year":"2013","event":"Continued service in the U.S. Senate."},{"year":"2019","event":"Continued service in the U.S. Senate."},{"year":"2025","event":"Upcoming term beginning in the U.S. Senate."}],"media":{"photos":["https://unitedstates.github.io/images/congress/450x550/W000437.jpg","https://unitedstates.github.io/images/congress/225x275/W000437.jpg"],"videos":[]}}