{"id":"lindsey-graham","name":"Lindsey O. Graham","title":"Senator","state":"South Carolina","party":"Republican","chamber":"Senate","seniority":"Senior","term_start":"2021-01-03","term_end":"2027-01-03","biography":{"summary":"Lindsey O. Graham is a United States Senator from South Carolina, serving since 2003. A Republican, he has focused on national security, foreign policy, and judiciary matters, and has previously served in the U.S. House of Representatives (1995-2003).","early_life":"Lindsey O. Graham was born in 1955 in Central, South Carolina. He earned a law degree from the University of South Carolina and began his political career in the South Carolina House of Representatives.","education":"University of South Carolina School of Law, J.D., 1981.","career":"Graham has served in the U.S. House of Representatives (1995-2003) before being elected to the U.S. Senate in 2002 (taking office in 2003). He has been involved in foreign policy and national security, including work on defense and counterterrorism."},"photo":{"profile":"https://unitedstates.github.io/images/congress/450x550/G000359.jpg","header":"https://unitedstates.github.io/images/congress/original/G000359.jpg"},"contact":{"office_address":"211 Russell Senate Office Building, Washington DC 20510","phone":"202-224-5972","fax":"202-224-3808","email_form":"https://www.lgraham.senate.gov/public/index.cfm/e-mail-senator-graham","website":"https://www.lgraham.senate.gov/public","social":{"twitter":"https://twitter.com/LindseyGrahamSC","facebook":"https://www.facebook.com/LindseyGrahamSC","youtube":"https://www.youtube.com/user/LindseyGrahamSC","instagram":"https://www.instagram.com/lindseygraham"}}}