{"id":"rick-scott","name":"Rick Scott","title":"Senator","state":"Florida","party":"Republican","chamber":"Senate","seniority":"Junior","term_start":"2019-01-08","term_end":"2025-01-03","biography":{"summary":"Rick Scott is an American politician who has served as the United States Senator from Florida since 2019. He previously served as Governor of Florida from 2011 to 2019.","early_life":"Born December 1, 1952, in Bloomington, Illinois.","education":"Education details not included in the provided data.","career":"Businessman and politician; former Governor of Florida."},"photo":{"profile":"https://unitedstates.github.io/images/congress/450x550/S001217.jpg","header":"https://unitedstates.github.io/images/congress/original/S001217.jpg"},"contact":{"office_address":"110 Hart Senate Office Building Washington DC 20510","phone":"202-224-5274","fax":"202-228-4535","email_form":"https://www.rickscott.senate.gov/contact/contact","website":"https://www.rickscott.senate.gov"},"committees":[],"policy_positions":[],"legislation":{"bills_sponsored":[],"recent_votes":[]},"timeline":[],"media":{"photos":["https://unitedstates.github.io/images/congress/450x550/S001217.jpg"],"videos":[]}}