{"id":"bernie-sanders","name":"Bernard Sanders","title":"Senator","state":"Vermont","party":"Independent","chamber":"Senate","seniority":"Senior","term_start":"2007-01-04","term_end":"2031-01-03","biography":{"summary":"Bernard Sanders is the senior United States Senator from Vermont, a founder of the progressive movement in national politics, and an advocate for universal healthcare, climate action, and economic reform.","early_life":"Born September 8, 1941, in New York City, Sanders attended Brooklyn College and the University of Chicago before engaging in local politics in Vermont and later national service.","education":"Attended Brooklyn College (CUNY) and studied at the University of Chicago; pursued public policy and economics as part of his political work.","career":"Mayor of Burlington (1981-1989); U.S. Representative (1991-2007); U.S. Senator (2007-present)."},"photo":{"profile":"https://unitedstates.github.io/images/congress/225x275/S000033.jpg","header":"https://unitedstates.github.io/images/congress/450x550/S000033.jpg"},"contact":{"office_address":"332 Dirksen Senate Office Building, Washington DC 20510","phone":"202-224-5141","fax":"202-228-0776","email_form":"http://www.sanders.senate.gov/contact/","website":"https://www.sanders.senate.gov","social":{"twitter":"https://twitter.com/BernieSanders","facebook":"https://www.facebook.com/BernieSanders","youtube":"https://www.youtube.com/user/SenatorBernieSanders","instagram":"https://www.instagram.com/berniesanders"}},"committees":[{"name":"Appropriations Committee","position":"Member"},{"name":"Budget Committee","position":"Member"}],"policy_positions":[{"topic":"Healthcare","stance":"Supports universal healthcare and Medicare-for-All-style reform."},{"topic":"Taxes and Inequality","stance":"Advocates progressive taxation and reducing income inequality."},{"topic":"Climate Change","stance":"Supports aggressive climate action and transition to clean energy."}],"legislation":{"bills_sponsored":[{"title":"Medicare for All Act","summary":"A bill to establish universal healthcare coverage through a publicly financed system.","introduced":"2017-01-03","status":"Introduced"},{"title":"Raise the Wage Act","summary":"A bill to raise the federal minimum wage to ensure a living wage for workers.","introduced":"2019-01-24","status":"Introduced"}],"recent_votes":[{"bill":"Medicare for All Act","position":"Yes","date":"2019-07-24"},{"bill":"Tax Cuts and Jobs Act","position":"No","date":"2017-12-20"}]},"timeline":[{"year":"1981","event":"Elected Mayor of Burlington, Vermont (1981-1989)"},{"year":"1991","event":"Elected to U.S. House of Representatives (1991-2007)"},{"year":"2007","event":"Elected to the U.S. Senate (2007-present)"},{"year":"2016","event":"Gained national prominence during a presidential campaign; continued Senate work."}],"media":{"photos":["https://unitedstates.github.io/images/congress/225x275/S000033.jpg","https://unitedstates.github.io/images/congress/450x550/S000033.jpg","https://unitedstates.github.io/images/congress/original/S000033.jpg"],"videos":[{"title":"Bernie Sanders on Healthcare Reform","url":"https://www.youtube.com/watch?v=dQw4w9WgXcQ"}]}}