{"id":"lisa-murkowski","name":"Lisa A. Murkowski","title":"Senator","state":"Alaska","party":"Republican","chamber":"Senate","seniority":"Senior","term_start":"2023-01-03","term_end":"2029-01-03","biography":{"summary":"Lisa A. Murkowski is an American politician serving as a United States Senator from Alaska since 2003. A Republican, she has been known for her pragmatic and occasionally independent approach within the party, focusing on energy, federal spending, and Alaska issues.","early_life":"Born May 22, 1957, in Ketchikan, Alaska.","education":"Georgetown University (BA in Economics).","career":"Before joining the Senate, Murkowski pursued public service in Alaska and was appointed to the U.S. Senate in 2003; she has since become one of Alaska's longest-serving senators."},"photo":{"profile":"https://unitedstates.github.io/images/congress/225x275/M001153.jpg","header":"https://unitedstates.github.io/images/congress/450x550/M001153.jpg"},"contact":{"website":"https://www.murkowski.senate.gov","office_address":"522 Hart Senate Office Building Washington DC 20510","phone":"202-224-6665","fax":"202-224-5301","email_form":"https://www.murkowski.senate.gov/public/index.cfm?p=EMailLisa"},"committees":[],"policy_positions":[],"legislation":{}}