{"id":"michael-bennet","name":"Michael F. Bennet","title":"Senator","state":"Colorado","party":"Democratic","chamber":"Senate","seniority":"Senior","term_start":"2023-01-03","term_end":"2029-01-03","biography":{"summary":"Michael F. Bennet is an American politician serving as the senior United States Senator from Colorado, a Democrat who has represented Colorado in the Senate since 2009."},"photo":{"profile":"https://unitedstates.github.io/images/congress/225x275/B001267.jpg","header":"https://unitedstates.github.io/images/congress/450x550/B001267.jpg"},"contact":{"office_address":"261 Russell Senate Office Building Washington DC 20510","phone":"202-224-5852","fax":"202-228-5097","email_form":"https://www.bennet.senate.gov/public/index.cfm/contact","website":"https://www.bennet.senate.gov"}}