{"id":"john-cornyn","name":"John Cornyn","title":"Senator","state":"Texas","party":"Republican","chamber":"Senate","seniority":"Senior","term_start":"2021-01-03","term_end":"2027-01-03","biography":{"summary":"John Cornyn is a Republican United States Senator from Texas, serving since 2003. He has held leadership positions including Senate Minority Whip (2013-2015) and Senate Majority Whip (2015-2017, 2017-2019). His work covers immigration, national security, fiscal policy, and judiciary matters."},"photo":{"profile":"https://unitedstates.github.io/images/congress/450x550/C001056.jpg","header":"https://unitedstates.github.io/images/congress/original/C001056.jpg"},"contact":{"website":"https://www.cornyn.senate.gov","office_address":"517 Hart Senate Office Building Washington DC 20510","phone":"202-224-2934","fax":"202-228-2856","email_form":"https://www.cornyn.senate.gov/contact"},"committees":[],"policy_positions":[],"legislation":{"bills_sponsored":[],"recent_votes":[]},"timeline":[{"year":"1952","event":"Born February 2, 1952."},{"year":"2003","event":"Elected United States Senator representing Texas."}],"media":{"photos":["https://unitedstates.github.io/images/congress/450x550/C001056.jpg","https://unitedstates.github.io/images/congress/original/C001056.jpg"],"videos":[]}}