{"id":"tim-kaine","name":"Timothy Kaine","title":"Senator","state":"Virginia","party":"Democratic","chamber":"Senate","seniority":"Junior","term_start":"2025-01-03","term_end":"2031-01-03","biography":{"summary":"Tim Kaine is an American lawyer and politician serving as the senior United States senator from Virginia since 2013. He previously served as Governor of Virginia (2006–2010) and as mayor of Richmond (1998–2001). He is a member of the Democratic Party."},"photo":{"profile":"https://unitedstates.github.io/images/congress/450x550/K000384.jpg","header":"https://unitedstates.github.io/images/congress/original/K000384.jpg"},"contact":{"website":"https://www.kaine.senate.gov","office_address":"231 Russell Senate Office Building, Washington, DC 20510","phone":"202-224-4024","fax":"202-228-6363","email_form":"https://www.kaine.senate.gov/contact","social":{"twitter":"https://twitter.com/timkaine","facebook":"https://www.facebook.com/timkaine","youtube":"https://www.youtube.com/@TimKaine","instagram":"https://www.instagram.com/timkaine"}}}