{"id":"mike-rounds","name":"Mike Rounds","title":"Senator","state":"South Dakota","party":"Republican","chamber":"Senate","seniority":"Junior","term_start":"2021-01-03","term_end":"2027-01-03","biography":{"summary":"Mike Rounds is a Republican U.S. Senator from South Dakota, serving since 2015. He previously served as Governor of South Dakota from 2003 to 2011."},"photo":{"profile":"https://unitedstates.github.io/images/congress/225x275/R000605.jpg","header":"https://unitedstates.github.io/images/congress/450x550/R000605.jpg"},"contact":{"office_address":"716 Hart Senate Office Building Washington DC 20510","phone":"202-224-5842","email_form":"https://www.rounds.senate.gov/contact/email-mike","website":"https://www.rounds.senate.gov","social":{}},"committees":[],"policy_positions":[],"legislation":{"bills_sponsored":[],"recent_votes":[]},"timeline":[{"year":"2015","event":"Elected to the United States Senate representing South Dakota."},{"year":"2020","event":"Re-elected to the United States Senate."}],"media":{"photos":["https://unitedstates.github.io/images/congress/225x275/R000605.jpg","https://unitedstates.github.io/images/congress/450x550/R000605.jpg","https://unitedstates.github.io/images/congress/original/R000605.jpg"],"videos":[]}}