{"id":"bill-hagerty","name":"Bill Hagerty","title":"Senator","state":"Tennessee","party":"Republican","chamber":"Senate","seniority":"Junior","term_start":"2021-01-03","term_end":"2027-01-03","photo":{"profile":"https://unitedstates.github.io/images/congress/225x275/H000601.jpg","header":"https://unitedstates.github.io/images/congress/450x550/H000601.jpg"},"contact":{"website":"https://www.hagerty.senate.gov","office_address":"251 Russell Senate Office Building Washington DC 20510","phone":"202-224-4944","email_form":"https://www.hagerty.senate.gov/email-me/"}}