{"id":"angela-denece-alsobrooks","name":"Angela Deneece Alsobrooks","title":"Senator","state":"Maryland","party":"Democratic","chamber":"Senate","seniority":"Junior","term_start":"2025-01-03","term_end":"2031-01-03","biography":{"summary":"Angela Deneece Alsobrooks is an American attorney and Democratic politician serving as a United States Senator from Maryland since 2025.","early_life":"","education":"","career":""},"photo":{"profile":"https://unitedstates.github.io/images/congress/225x275/A000382.jpg","header":"https://unitedstates.github.io/images/congress/450x550/A000382.jpg"},"contact":{"office_address":"374 Russell Senate Office Building Washington DC 20510","phone":"202-224-4524","email_form":"https://alsobrooks.senate.gov/","website":"https://www.alsobrooks.senate.gov"}}