{"id":"jon-husted","name":"Jon Allen Husted","title":"Senator","state":"Ohio","party":"Republican","chamber":"Senate","seniority":"Junior","term_start":"2025-01-21","term_end":"2029-01-03","biography":{"summary":"Appointed to the United States Senate from Ohio in 2025 to fill a vacancy, and serves in the Senate through a special-election cycle.","early_life":"Not specified in the provided data.","education":"Not specified in the provided data.","career":"Not specified in the provided data."},"photo":{"profile":"https://unitedstates.github.io/images/congress/225x275/H001104.jpg","header":"https://unitedstates.github.io/images/congress/450x550/H001104.jpg"},"contact":{"office_address":"304 Russell Senate Office Building Washington DC 20510","phone":"202-224-3353","website":"https://www.husted.senate.gov","social":{}},"committees":[],"policy_positions":[],"legislation":{"bills_sponsored":[],"recent_votes":[]},"timeline":[],"media":{"photos":["https://unitedstates.github.io/images/congress/225x275/H001104.jpg","https://unitedstates.github.io/images/congress/450x550/H001104.jpg"],"videos":[]}}