{"id":"john-kennedy","name":"John Neely Kennedy","title":"Senator","state":"Louisiana","party":"Republican","chamber":"Senate","seniority":"Junior","term_start":"2023-01-03","term_end":"2029-01-03","biography":{"summary":"John Neely Kennedy is the United States Senator from Louisiana, serving since 2017. An attorney and former Louisiana State Treasurer, he is known for fiscal conservatism and a direct, outspoken approach to policy."},"photo":{"profile":"https://unitedstates.github.io/images/congress/225x275/K000393.jpg","header":"https://unitedstates.github.io/images/congress/450x550/K000393.jpg"},"contact":{"website":"https://www.kennedy.senate.gov/public","office_address":"437 Russell Senate Office Building Washington DC 20510","phone":"202-224-4623","email_form":"https://www.kennedy.senate.gov/public/email-me"},"timeline":[],"committees":[],"policy_positions":[],"legislation":{"bills_sponsored":[],"recent_votes":[]},"media":{"photos":[],"videos":[]}}